id,content,username,url,upvotes,comments,timestamp,subreddit,keywords
1,New Solid Electrolyte Matches Liquid Performance. Better solid electrolytes could result in safer batteries that don’t explode.,@user,https://spectrum.ieee.org/battery-electrolyte,647,38,12 hr. ago,,"new solid electrolyte matches liquid performance, better solid electrolytes could result, safer batteries, ’, explode"
2,US researchers develop 'unhackable' computer chip that works on light | Computations can be performed at light speed in this chip which is ready for deployment for building AI models immediately.,@user,https://interestingengineering.com/innovation/unhackable-computer-chip-works-on-light,534,93,16 hr. ago,,"building ai models immediately, us researchers develop, light speed, computer chip, light, chip, works, unhackable, ready, performed, deployment, computations"
3,"LED glass basketball court to make NBA debut this month, displaying stats and replays | Courts can also display other entertainment content and host potentially any hardcourt sport",@user,https://www.techspot.com/news/101908-led-glass-basketball-court-make-nba-debut-month.html,394,91,14 hr. ago,,"led glass basketball court, make nba debut, host potentially, hardcourt sport, entertainment content, displaying stats, also display, replays, month, courts"
4,The existence of a new kind of magnetism has been confirmed,@user,https://www.newscientist.com/article/2417255-the-existence-of-a-new-kind-of-magnetism-has-been-confirmed/,1,133,1 day ago,,"new kind, magnetism, existence, confirmed"
5,New chip opens door to AI computing at light speed,@user,https://phys.org/news/2024-02-chip-door-ai.html,8,2,3 hr. ago,,"new chip opens door, light speed, ai computing"
6,Ultrasound waves spark movement in sleepy sperm by up to 266%,@user,https://newatlas.com/medical/ultrasound-waves-sperm-motility/,952,97,2 days ago,,"ultrasound waves spark movement, sleepy sperm, 266"
7,"Surgical robot, MIRA, aces zero-gravity examination in space | SpaceMIRA, a miniature surgical robot, excels in zero gravity, promising revolutionary advances in remote surgery and healthcare accessibility worldwide.",@user,https://interestingengineering.com/innovation/surgical-robot-mira-succeeds-space,106,3,1 day ago,,"promising revolutionary advances, healthcare accessibility worldwide, miniature surgical robot, surgical robot, zero gravity, remote surgery, gravity examination, aces zero, spacemira, space, mira, excels"
8,Open AI can now create video from text,@user,https://openai.com/sora,24,4,1 day ago,,"open ai, create video, text"
9,"Magnetic robotic catheter devised to efficiently treat ischemic strokes | The cutting-edge device with helical surface and rotational motion can navigate the vascular system efficiently, targeting diseased blood vessels with precision.",@user,https://interestingengineering.com/science/magnetic-robotic-catheter-devised-to-efficiently-treat-ischemic-strokes,680,24,2 days ago,,"targeting diseased blood vessels, magnetic robotic catheter devised, efficiently treat ischemic strokes, vascular system efficiently, rotational motion, helical surface, edge device, precision, navigate, cutting"
10,NASA Puts Next-Gen Exoplanet-Imaging Technology to the Test,@user,https://www.jpl.nasa.gov/news/nasa-puts-next-gen-exoplanet-imaging-technology-to-the-test,904,15,2 days ago,,"nasa puts next, imaging technology, gen exoplanet, test"
11,Open-Source Security Chip Released. The first commercial chip based on the OpenTitan hardware security design has hit the market.,@user,https://spectrum.ieee.org/open-titan-chip,335,11,3 days ago,,"source security chip released, opentitan hardware security design, first commercial chip based, open, market, hit"
12,"Replacement cartilage can grow in any shape with 3D-printed ""spheroids""",@user,https://newatlas.com/medical/cartilage-stem-cells-any-shape-3d-printed-spheroids/,655,34,3 days ago,,"replacement cartilage, spheroids, shape, printed, grow, 3d"
13,"Chinese researchers develop calcium-based battery that lasts 700 cycles | Stable in the air at room temperature, the calcium-oxygen battery can be transformed into flexible fibers for next-gen wearables.",@user,https://interestingengineering.com/energy/chinese-researchers-develop-calcium-based-battery,1,74,4 days ago,,"chinese researchers develop calcium, lasts 700 cycles, room temperature, oxygen battery, gen wearables, flexible fibers, based battery, calcium, transformed, stable, next, air"
14,OpenAI CEO warns that 'societal misalignments' could make artificial intelligence dangerous,@user,https://apnews.com/article/uae-openai-sam-altman-artificial-intelligence-9593a03830c0ef83fdef76c68bb87118,137,18,3 days ago,,"could make artificial intelligence dangerous, openai ceo warns, societal misalignments"
15,"28-ton, 1.2-megawatt tidal kite is now exporting power to the grid",@user,https://newatlas.com/energy/minesto-tidal-kite/,1,101,5 days ago,,"megawatt tidal kite, exporting power, ton, grid, 28, 2, 1"
16,Shining Laser Light on Glass Creates a Solar Cell | New energy and sensor applications could await,@user,https://spectrum.ieee.org/next-generation-solar-transparent-glass,261,5,4 days ago,,"sensor applications could await, shining laser light, solar cell, new energy, glass creates"
17,"Tokyo scientists create nanoscrolls for next-gen tech | Researchers achieved a major breakthrough by crafting nanoscrolls using Janus nanosheets. This innovation unlocks doors to exciting possibilities in catalysis, optics, and clean energy.",@user,https://interestingengineering.com/innovation/tokyo-scientists-create-nanoscrolls-for-next-gen-tech,785,25,5 days ago,,"crafting nanoscrolls using janus nanosheets, tokyo scientists create nanoscrolls, innovation unlocks doors, researchers achieved, major breakthrough, gen tech, exciting possibilities, clean energy, optics, next, catalysis"
18,"Deep Space Station 13 at NASA’s Goldstone complex in California – part of the agency’s Deep Space Network – is an experimental antenna that has been retrofitted with an optical terminal. In a first, this proof of concept received both radio frequency & laser signals from deep space at the same time.",@user,https://www.nasa.gov/technology/space-comms/deep-space-network/nasas-new-experimental-antenna-tracks-deep-space-laser/,5,4,4 days ago,space,"deep space station 13, deep space network –, california – part, deep space, radio frequency, optical terminal, nasa ’, laser signals, goldstone complex, experimental antenna, concept received, agency ’, time, retrofitted, proof, first"
19,'A mouse for your mouth': New device allows users to scroll with their tongues,@user,https://www.nbcnews.com/tech/tech-news/tongue-controlled-touchscreens-hit-market-year-rcna133270,820,110,5 days ago,,"mouth ': new device allows users, tongues, scroll, mouse"
20,"This ultrasound sticker senses changing stiffness of deep internal organs. The sticky, wearable sensor could help identify early signs of acute liver failure.",@user,https://news.mit.edu/2024/ultrasound-sticker-senses-changing-stiffness-deep-internal-organs-0209,865,29,6 days ago,,"wearable sensor could help identify early signs, ultrasound sticker senses changing stiffness, deep internal organs, acute liver failure, sticky"
21,"In a First, a Prosthetic Limb Can Sense Temperature Like a Living Hand",@user,https://www.smithsonianmag.com/science-nature/in-a-first-a-prosthetic-limb-can-sense-temperature-like-a-living-hand-180983765/,1,41,7 days ago,,"sense temperature like, prosthetic limb, living hand, first"
22,Alternate qubit design does error correction in hardware. Early-stage technology has the potential to cut qubits needed for useful computers.,@user,https://arstechnica.com/science/2024/02/alternate-qubit-design-does-error-correction-in-hardware/,136,0,7 days ago,,"cut qubits needed, alternate qubit design, useful computers, stage technology, error correction, potential, hardware, early"
23,Scientists develop a low-cost device to make cell therapy safer | A plastic microfluidic chip can remove some risky cells that could potentially become tumors before they are implanted in a patient.,@user,https://news.mit.edu/2024/scientists-develop-low-cost-device-safer-cell-therapy-0207,46,5,7 days ago,,"make cell therapy safer, could potentially become tumors, plastic microfluidic chip, scientists develop, risky cells, cost device, remove, patient, low, implanted"
24,"Gel and lithium-ion tech could enable 1000-mile EV range on one charge | Researchers achieve EV battery breakthrough with silicon-based materials and gel electrolytes, moving closer to a 1,000-kilometer range on a single charge.",@user,https://interestingengineering.com/transportation/gel-lithium-ion-tech-1000-mile-ev,852,90,8 days ago,,"ion tech could enable 1000, researchers achieve ev battery breakthrough, mile ev range, kilometer range, single charge, one charge, moving closer, based materials, gel electrolytes, gel, silicon, lithium, 1, 000"
25,Inhalable sensors could enable early lung cancer detection,@user,https://news.mit.edu/2024/inhalable-sensors-early-lung-cancer-detection-0105,1,60,8 days ago,,inhalable sensors could enable early lung cancer detection
26,AI can now master your music—and it does shockingly well,@user,https://arstechnica.com/ai/2024/02/mastering-music-is-hard-can-one-click-ai-make-it-easy/,370,83,9 days ago,,"shockingly well, music —, master, ai"
27,CERN unleashes powerful robot-dog to inspect nuclear radiation zones,@user,https://interestingengineering.com/innovation/cern-unleashes-powerful-robot-dog,580,51,9 days ago,,"inspect nuclear radiation zones, cern unleashes powerful robot, dog"
28,Sugar cane waste converted into concrete-beating Sugarcrete | Substance has been incorporated into an eco-friendly building material,@user,https://newatlas.com/environment/sugar-cane-waste-sugarcrete-building-material/,2,142,10 days ago,,"sugar cane waste converted, friendly building material, beating sugarcrete, substance, incorporated, eco, concrete"
